{
  "$schema": "../Schemas/building-preset-pack.schema.json",
  "schema": "moyva.building-preset-pack",
  "version": 1,
  "packId": "moyva.base-buildings.2026-08",
  "requiresSchemaVersion": 1,
  "applyPolicy": "idempotent",
  "applyProposedModules": false,
  "presets": [
    "wood-camp",
    "farm",
    "sawmill",
    "stone-quarry",
    "iron-mine",
    "smelter",
    "storage",
    "barn",
    "caravan-depot",
    "weapon-workshop",
    "armor-workshop",
    "barrack",
    "stable",
    "engineers-guild",
    "townhall",
    "castle-01",
    "house-01",
    "stone-gate",
    "stone-wall",
    "windmill-01"
  ],
  "resourceAliases": {
    "logs": "walnut-wood-materials-resources",
    "boards": "hardwood-materials-resources",
    "stone": "stone-materials-resources",
    "iron": "iron-ingot-materials-resources"
  },
  "notes": [
    "Code-first -> compile -> apply.",
    "Conditional/proposed modules are documented but not attached automatically.",
    "Weapon/Armor production remains deferred until valid resource/recipe IDs exist.",
    "Recruitment/Training is outside this patch."
  ]
}
